ID,Identificador,Nombre,Descripcion
1,PRJ-2025-001,Sistema de Ventas Online,Desarrollo de plataforma e-commerce para ventas en línea con gestión de inventario
2,PRJ-2025-002,App Móvil Corporativa,Aplicación móvil para gestión interna de empleados y recursos
3,PRJ-2025-003,Portal Web Institucional,Rediseño completo del sitio web corporativo con CMS
4,PRJ-2025-004,Sistema de Reportes,Dashboard ejecutivo con reportes automáticos y análisis de datos
5,PRJ-2025-005,Plataforma de Capacitación,Sistema de e-learning para capacitación de empleados
